职位名称,公司名,地点,薪资
Python软件工程师,大连东软教育科技集团有限公司,大连-高新园区,1-1.8万/月
高级python软件开发工程师,美国多核技术有限公司,深圳,1.5-2万/月
java人工智能（python)开发签约实习生,青岛迈科思软件有限责任公司,青岛,4.5-6千/月
Python开发工程师,绿之能科技,西安-碑林区,6-8千/月
Python开发工程师,无锡开普勒信息技术有限公司,无锡-梁溪区,0.4-1.2万/月
Python开发工程师,深圳市壹佳壹信息技术有限公司,深圳-龙岗区,1-1.5万/月
Python高级开发工程师,深圳趣晓网络科技有限公司,深圳-南山区,1.5-2.5万/月
少儿编程讲师（Java/Android/Python),东莞市童程童美信息科技有限公司,异地招聘,1-1.5万/月
Python工程师,深圳市华腾半导体设备有限公司,深圳-光明新区,1-1.5万/月
Python高级开发工程师,北京文泽智远信息技术有限公司,北京-海淀区,1.5-2万/月
Python开发工程师,武汉辰网络科技有限公司,武汉-洪山区,6-8千/月
Python算法工程师,亿翰智库,上海-静安区,1.5-2万/月
Python开发工程师,赛伯尔（大连）信息技术咨询有限公...,大连-高新园区,0.8-1万/月
C++/Python工程师（可视化方向）,成都安世亚太科技有限公司,成都-锦江区,20-30万/年
python开发工程师,“前程无忧”51job.com（光谷）,武汉-江夏区,8-10万/年
Python高级开发工程师,大连华信计算机技术股份有限公司,西安-雁塔区,1.1-1.6万/月
高级开发工程师（PHP/PYTHON/GO方向）,云南省人才服务中心,昆明,1-1.5万/月
Python开发工程师,米思米（中国）精密机械贸易有限公...,上海-静安区,1-2.2万/月
Python开发工程师-苏州,深圳市讯方技术股份有限公司,苏州,0.8-1万/月
高学历人才储备（Python开发经理）,恒信汽车集团股份有限公司,武汉-汉阳区,0.8-1.5万/月
Python开发工程师,南京数坤信息科技有限公司,南京-鼓楼区,1-2万/月
"Python, Swift, Java 软件工程师",宁波创母体网络科技有限公司,宁波,4-6千/月
Python算法工程师,浙江正洁环境科技有限公司,杭州-江干区,1.5-2万/月
Python开发工程师,申朴信息技术（上海）股份有限公司...,上海-浦东新区,1-1.7万/月
python编程老师,武汉卡巴KABBA教育,武汉-洪山区,0.6-1万/月
python自动化测试工程师（游戏项目）,宁波比孚信息科技有限公司,上海-杨浦区,1-1.5万/月
PHP高级程序员(python程序员）,浙江房洽洽网络科技有限公司,宁波,0.8-1.5万/月
python开发工程师,上海全卫物业管理有限公司,上海-杨浦区,1-1.5万/月
Python软件工程师,上海华屹数码科技有限公司,上海-徐汇区,1-1.5万/月
上市医药公司 Python开发工程师,万宝盛华企业管理咨询（上海）有限...,上海-浦东新区,12-18万/年
Python开发工程师,云南紫米科技有限公司,昆明,0.8-1万/月
Python开发工程师,浙江一舟电子科技股份有限公司,宁波-鄞州区,10-15万/年
Python开发工程师,深圳市易佰网络科技有限公司武汉分...,武汉,1-1.5万/月
游戏服务器PYTHON开发(YF),上海辛辣网络科技有限公司,上海-徐汇区,0.8-1.2万/月
Python开发工程师,北京御芯微科技有限公司,重庆-沙坪坝区,0.7-1.2万/月
Python开发工程师,亚创（上海）工程技术有限公司,上海,1-2万/月
Python高级开发工程师,上海催米网络科技有限公司,上海-浦东新区,1.8-3万/月
初级Python工程师助理(双休五险）,大连亚丁科技有限公司,大连,4.5-6千/月
Python开发工程师,深圳市前沿软件开发有限公司,广州-天河区,4.5-6千/月
Python高级开发工程师,尤盛信息技术（上海）有限公司,上海-浦东新区,1.8-3万/月
Python开发工程师,杭州万纵信息科技有限公司,杭州,0.8-1.5万/月
Python开发工程师,北京泽塔云科技股份有限公司,北京-朝阳区,1-2万/月
Python开发工程师,北京三六九数动科技有限公司,北京-朝阳区,2-2.5万/月
Python（AI人工智能）开发实习生,中天软（山东）科技集团有限公司,济南-历下区,6-8千/月
Python开发工程师,云汉芯城（上海）互联网科技股份有...,上海-松江区,1.5-2.5万/月
Python开发工程师,大连必捷必信息技术有限公司,大连-高新园区,0.8-1.5万/月
软件工程师（Python）,珠海市运泰利自动化设备有限公司,珠海,0.8-1.5万/月
Python开发工程师,大连铭信科技发展有限公司,大连-高新园区,0.8-1.3万/月
后端开发工程师（Python方向）,中金智汇科技有限责任公司,北京-大兴区,1-2万/月
Python高级开发工程师,山东便客信息科技有限公司,济南-市中区,0.7-1.4万/月
python web后台开发,繁翰信息技术（上海）有限公司,上海-长宁区,0.6-1.5万/月
Python开发工程师,深圳神木源科技有限公司,深圳-龙华新区,6-8千/月
python课程设计师,武汉市英才世家教育科技有限公司,武汉,5-7千/月
Python软件工程师,成都市鹰诺实业有限公司深圳分公司...,深圳,1.5-2万/月
python后台开发工程师,上海嘉柒智能科技有限公司,上海,1-1.5万/月
Python开发工程师,广州优视电子有限责任公司,广州-番禺区,0.5-1.2万/月
运维开发工程师（Python开发）,上海钢银电子商务股份有限公司,上海,2.5-4万/月
Python开发工程师,浙江中建网络科技股份有限公司,杭州-滨江区,1-1.5万/月
Python语言培训讲师,烟台炬龙文化传媒有限公司,烟台,6-8千/月
Python开发工程师3,深圳神木源科技有限公司,深圳-福田区,6-8千/月
Python数据工程师,广东南芯医疗科技有限公司,广州-黄埔区,1-1.5万/月
python爬虫/数据开发,南京市秦淮区巩向明软件开发工作室...,南京-雨花台区,4.5-6千/月
web/PHP/Java/Python工程师,盛科网络（苏州）有限公司,苏州-工业园区,0.8-1.5万/月
Python开发工程师,深圳市光逸科技创新有限公司,深圳-福田区,1.5-2万/月
Python开发工程师,苏州城方信息技术有限公司,苏州-工业园区,0.7-1.2万/月
Python开发工程师,苏州新亚科技有限公司,异地招聘,6-8千/月
Python开发工程师,上海瀚茗斯网络科技有限公司,深圳-宝安区,1-1.5万/月
python开发工程师（双休+奖金）,成都加糖科技有限公司,成都-武侯区,4.5-8千/月
Python后台开发工程师,重庆科斯迈生物科技有限公司,重庆-渝北区,0.8-1万/月
高级python工程师,广东博士科技有限公司,广州-黄埔区,1.3-2万/月
大数据开发工程师（python）,上海贝耳塔信息技术有限公司,上海,3-3.5万/月
python方向助理工程师,陕西企长网络科技有限公司,深圳-龙华新区,3-4.5千/月
六险急招python软件工程师,北京正橹航空服务有限公司,长沙-天心区,0.7-1万/月
python---外派绿盟科技（驻场）,西安鼎拓信息科技有限公司,西安-雁塔区,0.5-1万/月
Python开发工程师,西安智园软件开发管理有限公司,西安,1-1.5万/月
初级Python工程师助理(提供住宿),大连凤凰树网络科技有限公司,大连-高新园区,3-4.5千/月
Python开发工程师（网络金融）,交银企业管理服务（上海）有限公司...,上海-徐汇区,1.5-2万/月
Python开发工程师,杭州网新颐和科技有限公司,上海-徐汇区,1.1-1.6万/月
Python开发工程师,博流智能科技（南京）有限公司,南京,15-30万/年
Python开发工程师,上海兆豪信息技术有限公司,杭州-江干区,0.8-1.5万/月
python开发（可实习),大连星宇科技有限公司,大连,4.5-6千/月
Python工程师,360金融,上海,2-3.5万/月
Python开发工程师,上海伦伟实业有限公司,上海,1.2-1.5万/月
Python开发工程师,赞同科技股份有限公司,南京,6-8千/月
python算法开发,上海慧度至明信息科技有限公司,上海-浦东新区,1.5-2万/月
Python开发工程师,杭州世介农业科技有限公司,杭州,1-1.5万/月
Python开发工程师,江西裕滔实业集团有限公司,南昌-青云谱区,4.5-6千/月
Python高级开发工程师,武汉云外恒信息技术有限公司,武汉-洪山区,1.5-2万/月
Python后端开发工程师,湖南云之翼软件有限公司,长沙,1-1.8万/月
